question,answer
What role does the claims section play in a life insurance policy document?,The claims section in a life insurance policy document provides instructions on how beneficiaries can make a claim and outlines the available choices for receiving the policys benefit. It serves as a guide for a smooth and efficient claims settlement process.
"Eligibility for policy loans, interest rates, repayment procedures, etc,","To understand eligibility for policy loans, interest rates, repayment procedures, and related details, refer to the loanrelated sections of the policy document. Additionally, contact LICs customer service for clarifications and to ensure accurate information."
What information is typically included in a certificate of insurance template?,"A certificate of insurance template usually includes the following information Date of Issuance Disclaimer Insurer Details Policy Holder Information Insurance Coverage Details Liability Limit Additional Information Declaration Signatures These details provide a summary of the insurance policy, including coverage, limits, disclaimers, and the commitment of parties involved."
"What is the definition and key characteristics of a ""Strategy"" within the context of an organizations planning?","A ""Strategy"" is a highlevel plan designed to achieve a particular longterm aim for the future success of the organization, such as the Human Resources Strategy or the Governance and Assurance Strategy. It addresses major issues, principles, and beliefs, often arising from government aims. Strategies are ratified by the Board or delegated Committee, disseminated widely, and reviewed less frequently."
What role does machine learning play in anomaly detection in stock prices?,"Machine learning algorithms can analyze vast amounts of data to detect anomalies in stock prices, helping investors predict unusual market behavior and make better trading decisions."
What is the difference between relative stock price momentum and absolute stock price momentum?,"Relative stock price momentum compares a stocks performance to a benchmark index or sector, while absolute stock price momentum measures a stocks performance in isolation without comparison."
What is a bluechip stock in stock trading?,"A bluechip stock is a large, wellestablished company with a history of stable earnings and a strong market position. Bluechip stocks are considered reliable and less volatile investments."
Explain the purpose of the Insuring Agreement in an insurance policy.,"The Insuring Agreement outlines the major promises made by the insurer, specifying what is covered. It includes commitments like paying losses for covered perils, providing services, or defending the insured in a liability lawsuit. This section is crucial in understanding the extent of coverage."
What is a stock split?,"A stock split is when a company divides its existing shares into multiple shares, effectively lowering the price per share. This does not change the overall value of the investment."
Highlight the features and flexibility of HDFC Lifes Click 2 Protect Life term plan.,"HDFC Lifes Click 2 Protect Life term plan offers notable features and flexibility, including Multiple Benefits Provides protection, longterm savings, and tax benefits based on the selected product features. Benefit Illustrations Mandatory benefit illustrations issued by IRDAI, showcasing how policy returns are computed for informed decisionmaking. Policy Schedule Details Clearly outlines sum assured, premium amount, and payment frequency for a comprehensive understanding. LockIn Period Information Informs policyholders about the lockin period, restricting policy withdrawal but allowing surrender with a specified value in case of exigencies. Exclusion and Riders Clarity Highlights exclusions, specifying circumstances not covered, and allows customization with optional riders like accidental death benefits. The plan is designed to adapt to changing needs, offering flexibility to adjust coverage and premium payment terms. HDFC Lifes Click 2 Protect Life ensures policyholders stay wellprotected through lifes evolving circumstances."
How does the use of lagged variables impact the accuracy of time series analysis for stock market forecasting?,"Lagged variables, which are past values of a variable, are used in time series analysis to capture historical trends and relationships that can help make more precise predictions about future stock market trends."
How does thirdparty motor insurance differ from comprehensive motor insurance?,"ThirdParty Motor Insurance Imagine driving with a safety net, but only for others. This legally mandated insurance protects you from financial liabilities you cause towards third parties people, vehicles, and property in an accident. If you hit someones car or injure a pedestrian, their expenses are covered. However, your own cars damage remains entirely your responsibility, regardless of whos at fault. This option usually comes with lower premiums due to its limited scope. It might be suitable for older vehicles, occasional drivers, or budgetconscious individuals who prioritize basic legal compliance. Comprehensive Motor Insurance Think of this as a fullfledged armor for both you and your car. It goes beyond thirdparty coverage by safeguarding both your own vehicle and third parties in various situations. If you accidentally damage your car, experience theft, face natural disaster losses, or cause an accident, youre financially protected. This comprehensive safety net comes with higher premiums due to its wider coverage. Its ideal for new car owners, frequent drivers, and individuals seeking complete protection for their vehicle and potential legal liabilities. The Key Difference The crucial distinction lies in the scope of coverage. Thirdparty acts as a legal shield for others, while comprehensive adds your own car as part of the protective bubble. Choosing the Right Fit The best option depends on your unique needs and budget. Consider these factors Car Value For expensive vehicles, comprehensive coverage might be more costeffective in the long run, avoiding hefty repair costs. Driving Frequency Frequent driving increases accident risks, making comprehensive coverage more relevant. Risk Tolerance How comfortable are you with potentially bearing repair costs if you opt for thirdparty insurance? Remember Thirdparty insurance fulfills the legal requirement but leaves you financially exposed for your own car. Comprehensive insurance offers wider protection but comes at a higher cost. Weigh your needs, budget, and risk tolerance before choosing a plan. Consulting a financial advisor or insurance agent can help you navigate the options and make an informed decision."
What are the potential risks associated with momentum investing based on stock price momentum?,"Risks include overvalued stocks, sudden reversals in price momentum, and the possibility of missing out on undervalued opportunities while focusing solely on stocks with positive momentum."
What are some common trading strategies based on stock price momentum?,"Common trading strategies based on stock price momentum include trend following, breakout trading, momentum trading, and mean reversion trading."
Can I withdraw partially from LIC policies for the girl child for specific financial needs?,"Partial withdrawals from LIC policies may be allowed, and these funds can be utilized for specific financial needs related to the girl child."
What is volume analysis in stock trading?,Volume analysis in stock trading is the examination of the number of shares traded in a particular security over a specific time period.
What role does consumer confidence play in stock trading models?,Consumer confidence reflects the sentiment of consumers towards the economy. A high level of consumer confidence can indicate increased spending and potentially higher stock prices.
How do templates assist in the loss adjustment process for insurance companies?,"Templates play a crucial role in the loss adjustment process for insurance companies by providing a standardized format for producing loss adjustment documents. Loss adjustment templates help expedite the assessment of liability, ensuring a quicker settlement for clients. These templates contribute to consistency and accuracy in the loss adjustment process."
Can pair trading be automated using algorithmic trading systems?,"Yes, pair trading can be automated using algorithmic trading systems that execute trades based on predefined criteria, market signals, and risk management parameters to capitalize on arbitrage opportunities efficiently."
How can adaptive trading algorithms handle sudden market shocks or black swan events?,"Adaptive trading algorithms can incorporate risk management protocols, such as circuit breakers, dynamic position sizing, and volatility filters, to mitigate the impact of sudden market shocks or black swan events."
How can sentiment analysis be used to gauge investor confidence in the market?,"Sentiment analysis can be employed to gauge investor confidence in the market by tracking sentiment indicators such as bullishbearish sentiment, feargreed index, and sentiment surveys conducted among investors."
How do pattern recognition algorithms aid in anomaly detection for stock prices?,"Pattern recognition algorithms analyze historical stock price patterns and trends to detect anomalies by flagging deviations from normal price behavior, assisting traders in spotting irregularities in market movements."
Is the grace period for missed premiums longer than competitors?,LIC typically provides a grace period for premium payments. Comparing this grace period with competitors involves checking the terms and duration offered by each company. Understanding the grace period is crucial to avoid policy lapses and ensure continued coverage.
How do market participants react to abrupt changes in stock price momentum?,"Market participants may react to abrupt changes in stock price momentum by adjusting their positions, implementing new trading strategies, or reassessing their investment thesis based on the evolving market conditions."
What are the different types of life insurance plans available in India?,"India offers a diverse range of life insurance plans to cater to various needs and financial goals. Heres a breakdown of the most common types Traditional Life Insurance Term Life Insurance Provides pure financial protection in case of the policyholders death. Affordable and ideal for basic coverage needs. No maturity benefit. Endowment Plans Combine life cover with a savings component. Pays a lump sum on maturity along with the death benefit. Premiums are typically higher than term plans. Whole Life Insurance Provides lifelong coverage and builds cash value over time. Premiums are higher than term plans, but you get a maturity benefit along with death protection. InvestmentLinked Life Insurance Unit Linked Insurance Plans ULIPs Combine marketlinked investments with life cover. Premiums are invested in different funds, offering the potential for higher returns but also market risks. Suitable for longterm wealth creation with life cover. Child Plans Specifically designed to secure your childs future needs like education and marriage. Offer guaranteed payouts at crucial stages like college admission or wedding. Retirement Plans Help build a retirement corpus through regular premiums. Offer tax benefits and guaranteed payouts upon retirement. Secure your financial independence in your golden years. Other Specialized Plans Critical Illness Insurance Covers financial losses arising from accidental injuries or critical illnesses. Ensures financial security and protects your loved ones future. Personal Accident Insurance Offers financial protection in case of accidents, providing compensation for medical expenses, disability income, and lump sum payouts. Choosing the Right Plan Consider these factors when selecting a life insurance plan Needs and Goals Identify your primary needs protection, savings, wealth creation and financial goals. Budget Choose a plan that aligns with your premium affordability. Coverage Ensure the sum assured provides adequate financial protection for your dependents. Policy Term Select a term that matches your needs, like childs education or retirement planning. Riders Consider optional riders for broader coverage like accidental death or critical illness."
How do regulatory bodies monitor and address anomalies in stock prices?,"Regulatory bodies use surveillance systems, data analysis tools, and market oversight to monitor anomalies in stock prices, investigate suspicious activities, and enforce compliance with trading regulations."
What are the eligibility criteria for LICs Cancer Cover Plan?,"LICs Cancer Cover Plan Plan No. 905, UIN No. 512N314V03 has specific eligibility criteria that potential policyholders need to meet. The minimum age at entry is 20 years, with a maximum of 65 years. The policy term ranges from a minimum of 10 years to a maximum of 30 years, and the age at maturity should be between 50 and 75 years. The minimum premium amount is Rs. 5000 per annum for all modes of payment. Additionally, the basic sum insured varies based on age categories, ranging from Rs. 35,00,000 to Rs. 50 lakhs. The plan offers flexibility with two benefit options  Level Sum Insured and Increasing Sum Insured. Policyholders should carefully consider their specific needs when choosing the type of Sum Insured at the inception, as premium and benefits vary accordingly."
Summarize the key points to consider when receiving an insurance policy document.,"Personal Details Accuracy Verify the accuracy of personal information, including name, address, age, employment, and medical history. Incorrect details can lead to claim rejections, and any changes must be promptly communicated. Benefits Confirmation Thoroughly review the benefits covered in the policy document to ensure alignment with communicated information. Check for mandatory benefit illustrations to understand policy returns computation. Policy Schedule Check Examine the policy schedule, covering sum assured, premium amount, and payment frequency. Report any errors immediately to the insurance company. LockIn Period Awareness Understand the lockin period, during which policy withdrawal is restricted. Familiarize yourself with surrender terms to avoid potential losses. Exclusions and Riders Review Carefully read the exclusion section, identifying circumstances not covered. Assess riders, such as accidental death benefits, to confirm they meet expectations. Remember that financial goals change, and policy adjustments may be necessary based on life events. Regularly review the policy document to ensure it aligns with evolving needs."
What risk management strategies are important when using trading signals?,"Risk management strategies such as setting stoploss orders, position sizing based on risk tolerance, and diversifying assets help traders protect capital and manage potential losses when following trading signals."
What unique riders are available with LIC compared to others?,"LIC provides various riders catering to specific needs, such as accidental death benefit, critical illness cover, and disability benefit. Comparing these riders with those offered by other companies involves assessing coverage, terms, and additional costs to determine uniqueness."
Explain the importance of insurance policy documentation for businesses today and its significance for an event tomorrow. Highlight the pros and cons of addressing or neglecting this aspect.,"Insurance policy documentation is crucial for businesses today and holds significance for future events. Heres why Importance for Businesses Today a. Assessment of Policies Allows businesses to review policy details, coverage amounts, and premium obligations for each insurance policy. b. Compliance Helps in complying with the specified provisions, rules, duties, and conduct outlined by insurers. c. Timely Payments Enables tracking of insurance start and end dates, ensuring timely premium payments. d. Risk Exposure Aids in assessing overall risk exposure by understanding the impact of insurance policies on the business. e. Gap Analysis Facilitates identifying any gaps in current insurance coverage, ensuring comprehensive risk management. f. Claims Process Provides clarity on the process of making claims under each policy. Importance for an Event Tomorrow a. Investor Evaluation Assists potential investors in evaluating the assets, risks, and the extent of insurance coverage. b. Policy Visibility Offers visibility into the number and nature of insurance policies held by the company. c. Financial Assessment Helps investors assess the frequency, cost, and legal obligations associated with each policy. d. Loss Compensation Allows understanding the financial compensation entitled to the company in case of a loss. e. Coverage Adequacy Evaluates if existing policies are sufficient or if additional coverage is needed. Pros of Addressing Insurance Policy Documentation a. Investor Clarity Provides investors with a clear understanding of the companys insurance coverage. b. Risk Mitigation Reduces the risk of policy lapse or cancellation by ensuring compliance with terms and renewal tracking. c. Business Continuity Assists in creating effective business continuity and disaster management plans. d. Transparency Enhances transparency between the company and insurers by documenting policy details. e. Legal Proof Acts as legal proof of ownership, aiding in case of potential disputes. Cons of Not Addressing This Topic a. Increased Workload Investors may face additional work to understand insurance coverage without clear documentation. b. Risk of Termination Higher risk of policy termination due to limited visibility of terms and compliance. c. Claims Difficulty Difficulty in claiming policy benefits due to unavailability of clear documentation. d. Expiry Tracking Issues Inability to track expiry and maturity dates of insurance policies. Addressing insurance policy documentation is crucial for maintaining transparency, ensuring compliance, and facilitating effective risk management for businesses. Neglecting this aspect can lead to increased risks, challenges in claims processing, and potential disputes."
Can news related to changes in government regulations influence a companys stock price?,"Yes, news about changes in regulations that can impact a companys operations or profitability can lead to significant changes in its stock price."
What impact does changes in exchange rates have on trading models integrating macroeconomic indicators?,"Exchange rate fluctuations influence international trade, investment decisions, and market volatility. Traders can monitor exchange rate changes to identify currency trends, assess risks associated with currency exposure, and optimize their trading strategies to benefit from currency movements."
What is the role of market surveillance algorithms in detecting anomalies in stock prices?,"Market surveillance algorithms continuously monitor market activities, identify suspicious trading behavior, and flag potential anomalies in stock prices to maintain market integrity and transparency."
Give some information about what information is included in the policy document?,"The policy document contains comprehensive details about the insurance policy, including terms and conditions, coverage, premium payment details, exclusions, and other crucial information. It serves as a legal contract between the policyholder and LIC, providing a thorough understanding of the policys features and obligations."
How does news about changes in commodity prices affect stock prices of companies in those industries?,"Changes in commodity prices can impact the stock prices of companies in industries like mining, energy, and agriculture. For example, a decline in oil prices may lead to lower stock prices for energy companies due to reduced revenues."
How accessible and responsive is LICs customer service compared to others?,"Assessing the accessibility and responsiveness of LICs customer service compared to other insurers involves considering factors like helpline availability, response time, and customer feedback. Policyholders can explore online reviews, customer testimonials, and industry surveys to gauge the level of satisfaction with LICs customer service. Additionally, direct interactions with customer service representatives can provide insights into the responsiveness of the support provided."
How do I pay my premiums?,"Premiums can be paid through various channels, including online payment through the LIC website, net banking, debitcredit card, or at the nearest LIC branch. Choose a convenient option that aligns with your preferences."
How many types of LIC policy available for students?,"LIC offers various policies suitable for students, including plans for education, savings, and protection. The specific types may vary, so its advisable to explore the available options based on individual needs."
"Expressing concerns, filing complaints, offering suggestions for improvement,","To express concerns, file complaints, or offer suggestions for improvement, contact LICs customer service through the designated channels. Utilize the official website, helpline numbers, or visit the nearest LIC branch for effective communication and resolution of concerns."
What is LICs claim settlement ratio compared to other leading companies?,"LIC consistently maintains a high claim settlement ratio, reflecting its commitment to honoring policy claims. Comparisons with other leading companies may vary, but LICs strong track record is indicative of its reliability in settling claims."
How do longterm investors use stock price momentum to inform their investment decisions?,"Longterm investors may use stock price momentum as a supplementary tool to identify entry and exit points for their investments, helping them optimize their portfolio allocation over time."
What are the major stock exchanges for stock trading?,"Major stock exchanges for stock trading include the New York Stock Exchange NYSE, NASDAQ, London Stock Exchange LSE, and Tokyo Stock Exchange TSE."
What are the limitations of using time series analysis for predicting stock market trends?,"Limitations include sensitivity to outliers, reliance on historical data, assumptions of linearity, and difficulty in capturing sudden changes or unpredictable events in stock prices."
Are there regulatory measures in place to monitor and detect anomalies in stock prices?,"Yes, regulatory bodies such as the Securities and Exchange Commission SEC monitor and detect anomalies in stock prices using market surveillance systems and tools to ensure fair and orderly trading practices."
What role does the exchange rate play in trading models integrating macroeconomic indicators?,"Exchange rates impact international trade, capital flows, and competitiveness, making them significant for traders assessing market opportunities and risks."
What are the key benefits of LIC policies for the girl child?,"LIC policies for the girl child offer benefits such as financial security, education support, and flexibility in utilizing policy proceeds for her future. These policies are designed to provide a secure financial foundation."
"Grace period, penalty charges, reinstatement procedures, etc,","Details about the grace period, penalty charges, reinstatement procedures, and related aspects can be found in the respective sections of the policy document. Familiarizing oneself with these details ensures compliance with payment timelines and avoids policy lapses."
What role does machine learning play in anomaly detection in stock prices?,"Machine learning algorithms can analyze vast amounts of historical data to identify patterns, trends, and anomalies in stock prices that may not be apparent through traditional analysis methods."
How do stock analysts use pricetoearnings ratios in predicting stock prices?,"Stock analysts use pricetoearnings ratios to evaluate the valuation of a company relative to its earnings and industry peers, which can help predict future stock price movements."
What are the key benefits of LIC policies for the girl child?,"LIC policies for the girl child provide essential advantages, including financial security, education support, and flexibility in utilizing policy proceeds for her future. These policies are strategically designed to establish a secure financial foundation, fostering a stable and empowered future for the girl child."
What are the benefits of having life insurance?,"The benefits of life insurance include providing financial security to loved ones, covering funeral expenses, paying off debts, replacing lost income, funding education, and leaving a legacy."
Can I name my girl child as the nominee in the LIC policy?,"Yes, you can designate your girl child as the nominee in your LIC policy. Naming her as the nominee ensures that, in the event of any unfortunate circumstance, the policy benefits directly go to her."
How can global economic events and geopolitical risks be integrated into trading models alongside macroeconomic indicators?,"Global economic events, such as trade disputes and geopolitical tensions, can impact financial markets and commodity prices, necessitating traders to consider broader macroeconomic factors in their models."
How does disability insurance work and why is it important?,Disability insurance provides income protection in case the insured is unable to work due to illness or injury. Its important because it helps replace lost income and maintain financial stability during a disability.
What is the difference between stocks and bonds?,"Stocks represent ownership in a company, while bonds represent a loan to a company or government."
