question,answer
What types of insurance policies are commonly offered in India?,"Life Insurance Term Life Insurance Features Provides the simplest and most affordable form of life cover. Pays a lump sum to your beneficiaries in case of your death during the policy term. No maturity benefit. Benefits Ideal for protecting your loved ones financial future, especially if you have dependents. Affordable way to ensure a safety net. Endowment Plans Features Combines life cover with a savings component. Pays a lump sum on maturity along with the death benefit. Premiums are typically higher than term plans. Benefits Offers both protection and savings elements. Suitable for wealth creation and securing life goals like child education or retirement. Whole Life Insurance Features Provides lifelong coverage and builds cash value over time. Premiums are higher than term plans, but you get a maturity benefit along with death protection. Benefits Offers lifelong financial security for your loved ones. Cash value can be used for emergencies or additional income during retirement. Unit Linked Insurance Plans ULIPs Features Combines life cover with marketlinked investments. Premiums are invested in different funds, offering the potential for higher returns but also market risks. Benefits Potential for higher returns compared to traditional plans. Investment flexibility based on risk appetite. Suitable for longterm wealth creation with life cover. Child Plans Features Specifically designed to secure your childs future needs like education and marriage. Offers guaranteed payouts at crucial stages like college admission or wedding. Benefits Ensures childs financial security even in your absence. Helps plan for major milestones in their life. Retirement Plans Features Helps build a retirement corpus through regular premiums. Offers tax benefits and guaranteed payouts upon retirement. Benefits Secures your financial independence in your golden years. Taxefficient way to plan for postretirement life. General Insurance Health Insurance Features Covers medical expenses arising due to illness, hospitalization, and other treatments. Various plans cater to individuals, families, senior citizens, and specific critical illnesses. Benefits Protects you from financial burden of healthcare costs. Ensures access to quality medical care without compromising savings. Motor Insurance Features Mandatory for all vehicles. Covers thirdparty liabilities and damages to your vehicle due to accidents, theft, and natural disasters. Optional addon covers available. Benefits Provides financial protection against unforeseen events on the road. Ensures legal and financial compliance. Home Insurance Features Protects your home against fire, theft, natural disasters, and other unforeseen events. Covers building structure, contents, and additional features like personal liability. Benefits Safeguards your valuable asset against losses. Provides peace of mind knowing your home is protected. Travel Insurance Features Covers trip cancellations, medical emergencies, baggage loss, and other travelrelated mishaps. Different plans cater to domestic and international travel. Benefits Ensures a smooth and worryfree travel experience. Protects you from financial losses due to unforeseen circumstances. Personal Accident Insurance Features Covers financial losses arising from accidental injuries or death. Provides compensation for medical expenses, disability income, and lump sum payouts. Benefits Offers financial security in case of accidents, protecting your income and loved ones future. Fire Insurance Features Protects your property against fire damage and related losses. Covers building structure, contents, and additional features like loss of rent. Benefits Provides financial protection against firerelated losses, safeguarding your property and investments. Other Specialized Insurance Crop Insurance Protects farmers against crop losses due to natural disasters and pests. Ensures financial stability and supports their livelihood. Cyber Insurance Covers businesses against financial losses due to cyberattacks and data breaches. Protects sensitive information and business continuity. Marine Insurance Covers cargo and ships against damage or loss during maritime transportation. Ensures smooth and secure movement of goods across the seas."
Is personalized agent support from LIC a significant advantage over onlinefocused competitors?,"LICs personalized agent support provides policyholders with direct assistance and guidance. Comparing this personalized support with the onlinefocused model of competitors involves assessing individual preferences. Policyholders who prefer personalized interactions and assistance may find LICs approach advantageous. However, those who prefer a more selfserviceoriented approach may find onlinefocused competitors more suitable. Evaluating personal preferences and communication styles is crucial in making this comparison."
"Differentiate a ""Local Procedure"" from an organisationwide procedure and outline its characteristics.","A ""Local Procedure"" impacts a specific part of the Trust, approved locally, and focuses on how to implement a required standard of working within a local context. These procedures, which may contain flow charts, are reviewed at least annually and may be incorporated into a policy document."
Are there specific policies for renters and homeowners?,"Renters Insurance Focuses on protecting your personal belongings within your rented space furniture, electronics, clothes, etc. against fire, theft, natural disasters, and more. Includes liability coverage if someone gets injured in your rented space and youre legally responsible. More affordable than homeowners insurance due to its limited scope. Homeowners Insurance Offers comprehensive protection for both the structure of your home and your belongings against various risks like fire, theft, natural disasters, vandalism, and more. Includes personal liability protection and optional coverages like loss of rent, personal accident insurance, and electronic equipment breakdown protection. Typically comes with a higher price tag than renters insurance due to its wider coverage. Choosing the Right Option Renters Consider getting renters insurance to protect your belongings and mitigate potential liability risks. Homeowners Choose a homeowners insurance plan based on your property value, belongings, and desired level of protection. Consider optional coverages if needed. Remember Carefully review policy documents to understand inclusions, exclusions, and limitations. Compare quotes from different insurers for the best coverage at an affordable price. Consult a financial advisor or insurance agent for help choosing the right policy based on your needs and budget. By understanding these distinctions, you can make an informed decision to protect your property and belongings effectively, whether youre a renter or a homeowner."
Can sentiment analysis be used to predict shortterm market movements?,"Yes, sentiment analysis can be used to predict shortterm market movements by uncovering patterns in investor sentiment that may impact stock prices in the near future."
How does the benefit illustration section in a life insurance policy document help policyholders?,The benefit illustration section in a life insurance policy document helps policyholders understand how the return on their policy money will be calculated at different rates. It provides clarity on the expected returns and assists in making informed decisions based on the policys financial projections.
How is volume calculated in stock trading?,Volume is calculated by multiplying the number of shares traded in a particular transaction by the price at which the transaction occurred.
What is a bull market in stock trading?,"A bull market is a period of rising stock prices, typically marked by a 20 or more increase from recent lows. It is characterized by optimism and investor confidence."
What considerations are important when selecting securities for a quantitative momentum strategy?,"Factors to consider include liquidity, volatility, correlation with other assets, and fundamental factors that can complement momentum signals and enhance the effectiveness of the strategy."
How does the relationship between price movements and volume help traders in identifying potential breakouts in the stock market?,The relationship between price movements and volume can help traders identify potential breakouts by looking for price movements accompanied by increasing trading volumes. A breakout with high volume often signals strong market interest and potential continuation of the trend.
What are the key features of LIC Bima Jyoti?,"LIC Bima Jyoti offers guaranteed additions, making it suitable for conservative investors. Investing Rs.1 Crore results in an additional Rs.1 Crore at maturity through guaranteed additions, with no risk if all premiums are paid. Key features include a 25 increase in the sum assured after all premiums are paid, guaranteed additions at Rs.50 per 1000 sum assured annually, various premium payment options, availability of a loan feature, and the option to buy online or offline."
What does home insurance cover in India?,"Home insurance in India offers protection against various financial losses related to your property and its contents. Heres a breakdown of the typical coverage you can expect Structure Coverage Fire and allied perils Covers losses caused by fire, lightning, explosion, aircraft damage, riots, and strikes. Natural disasters Protects against damage caused by earthquakes, floods, storms, cyclones, and other natural calamities. Burglary and theft Reimburses the value of belongings stolen from your home during a breakin. Malicious damage Covers damage caused by vandalism or intentional acts of destruction. Contents Coverage Loss or damage to household belongings Protects furniture, electronics, appliances, and other personal items within your home. Jewelry and valuables Some policies offer special coverage for valuable items like jewelry, artwork, or electronics with additional premium payments. Additional Coverages may vary depending on the policy Public liability Protects you against legal liabilities if someone gets injured or their property gets damaged within your home. Personal accident Provides financial assistance in case of accidental death, disability, or medical expenses incurred by the insured or their family members within the home. Loss of rent Covers rental income loss if your property becomes uninhabitable due to a covered event. Electronic equipment breakdown Offers protection against sudden damage or breakdown of electronic appliances. Things to remember Coverage varies depending on the specific policy you choose. Always read the policy document carefully to understand the inclusions, exclusions, and limitations. The sum insured amount covered is crucial. Ensure it accurately reflects the value of your property and belongings. Consider adding riders for additional coverage like personal accident, loss of rent, or electronic equipment breakdown if needed. Compare quotes from different insurers to find the best coverage at an affordable premium."
Who should opt for the accidental death benefit and disability rider,Individuals seeking enhanced financial protection in the event of accidental death or disability should opt for the Accidental Death Benefit and Disability Rider. It provides additional coverage beyond the base life insurance policy.
Do independent agencies award higher financial strength ratings to LIC competitors?,"Financial strength ratings from independent agencies assess an insurance companys ability to meet financial obligations. Comparing these ratings between LIC and its competitors can provide an understanding of their financial stability. Such ratings are available from agencies like AM Best, Moodys, or SP Global. Policyholders can refer to these agencies reports or the respective company websites for comprehensive information on financial strength ratings."
How do industry trends and sector rotation affect stock price predictions?,"Industry trends and sector rotation refer to shifts in investor preference towards specific sectors, which can impact stock price predictions as investors reallocate capital based on changing market conditions."
What advantages do LIC policies offer specifically for the girl child?,"LIC policies for the girl child offer critical benefits, encompassing financial security, assistance for education expenses, and the flexibility to utilize policy proceeds for future needs. These policies are intricately crafted to establish a robust financial foundation, ensuring a secure and empowered future for the girl child."
Can predictive modeling be used for forecasting implied volatility surfaces in options trading?,"Yes, predictive modeling can be employed to forecast implied volatility surfaces, which represent the relationship between option prices and implied volatility levels across different strike prices and maturities."
What benefits does LIC Bima Jyoti offer for death?,"LIC Bima Jyoti provides a death benefit in case of the policyholders demise within the policy tenure. If death occurs after 5 policy years, the family can claim 125 of the basic sum assured, along with guaranteed additions. If death occurs after 15 policy years, the family can claim 125 of the basic sum assured, along with guaranteed additions."
What steps are involved in processing a claim report?,"Processing a claim report involves the insurer reviewing the submitted documentation, assessing the validity of the claim, conducting investigations if necessary, and determining the amount of compensation to be paid."
What is a stock market index?,A stock market index is a measurement of the value of a section of the stock market calculated from the prices of selected stocks.
