question,answer
What role does seasonality play in time series analysis for stock market forecasting?,"Seasonality refers to recurring patterns or trends in stock prices that occur at specific times of the year. By analyzing seasonal patterns in historical data, traders can predict potential market movements and adjust their trading strategies accordingly."
How does insurance underwriting work?,"Insurance underwriting is the process of evaluating the risk and determining the premium for an insurance policy. Underwriters assess various factors such as the applicants age, health status, occupation, lifestyle, and claims history to decide whether to issue a policy and at what cost. ,"
How can policyholders request a claim report?,"Policyholders can request a claim report by contacting their insurance provider directly through phone, email, or the insurers online portal."
How do adaptive trading algorithms adapt to changes in market regimes?,Adaptive trading algorithms use pattern recognition and statistical models to detect shifts in market regimes and adjust their strategies accordingly.
Where can I find more information about my specific policy?,"For detailed information about a specific policy, policyholders can refer to the Policy Details section in the policy document. Additionally, LICs official website and customer service channels provide valuable information. Policyholders can contact LICs customer service, visit the nearest LIC branch, or log in to their online accounts to access policyrelated information, including coverage details, premium due dates, and other relevant data."
What are the key features of a good health insurance plan?,"Individual and Family Health Insurance Coverage Protects against individual or collective illness, hospitalization, surgeries, critical illnesses, accidents, and even preexisting conditions. Flexibility Choose from various sum assured options and policy terms to fit your budget and needs. Critical Illness Insurance Focus Offers a substantial lump sum payout upon diagnosis of a covered critical illness like heart attack, cancer, or stroke. Benefit Provides financial assistance for treatment and helps manage the burden of a critical illness. Senior Citizen Insurance Tailored Designed specifically for senior citizens, covering agerelated diseases, illness, hospitalization, and surgeries. Security Offers peace of mind with coverage addressing specific health concerns of older adults. Super TopUp Plan Enhancement Provides additional coverage on top of your existing health plan when the initial sum insured falls short. Value Ideal for people with high healthcare expenses, ensuring comprehensive coverage. Group Health Insurance Efficiency Covers a group of employees or association members, offering standardized coverage for illness, hospitalization, accidents, and preexisting conditions. Convenience Often offered by employers, providing economical coverage for group members. Additional Coverage Options Maternity Coverage Helps manage pregnancyrelated expenses, including delivery, prenatal care, and newborn medical costs. Accidental Death Benefit Provides financial security to your family in case of your accidental death. Income Loss Benefit Offers a financial safety net in case of disability due to accident or illness. Optional Riders Customize your plan with riders covering specific needs like ambulance charges, daily cash allowance during hospitalization, or dental care. Choosing the Right Plan Beyond understanding the types, consider these crucial factors for a good health insurance plan Sum Assured Ensure it adequately covers anticipated medical expenses. Premium Find a plan that fits your budget while offering valuable benefits. Network Hospitals Opt for a plan with a network including hospitals you prefer. Claim Settlement Process Choose a plan with a clear and hasslefree claim process. Preexisting Conditions Disclose them and consider plans that cover them. Deductible Understand the amount you pay upfront before claims are covered. Exclusions Be aware of any exclusions applicable to the plan. Policy Renewability Ensure the plan is renewable and understand the terms. Claim Bonus Look for plans that reward claimfree years."
What is Policy Extension?,"Policy Extension refers to the provision in an insurance policy that allows the policyholder to extend the coverage beyond the original policy term. It provides continuity of coverage for a specified period, offering additional protection and benefits."
What is the importance of nomination in a life insurance policy?,"Nomination in a life insurance policy is crucial as it allows the policyholder to specify individuals who will receive the policy benefits in case of the insureds death. This ensures a smooth and clear settlement of claims, avoiding complications in identifying the rightful recipients."
What are some key factors to consider when designing a predictive model for derivatives trading?,"Key factors to consider include the choice of predictive variables, model selection, data preprocessing techniques, and evaluation metrics to assess the performance of the model."
What is exponential smoothing and how is it used in time series analysis for stock trading?,"Exponential smoothing assigns exponentially decreasing weights to past observations, giving more importance to recent data points when forecasting market trends."
What data sources are useful for conducting statistical arbitrage analysis?,"Data sources such as historical stock prices, volume data, financial statements, and market indicators are useful for conducting statistical arbitrage analysis and identifying potential trading opportunities."
"Define ""Clinical Guidelines"" and describe their key characteristics.","""Clinical Guidelines"" are statements of good practice in the treatment and care of patients. Ratified at trust or local level, they provide detailed statements of what, when, and how. Reflecting evidencebased practices, they allow for deviation under specific circumstances, require frequent reviews at least annually, and are ratified at appropriate Clinical Committees."
What are technical indicators commonly used in stock price prediction?,"Common technical indicators include moving averages, Relative Strength Index RSI, and Bollinger Bands."
What are the implications of trading during market hours versus after hours?,"Trading during market hours provides more liquidity and price transparency, while afterhours trading can have lower volume and wider bidask spreads. Traders should be aware of the risks associated with afterhours trading, such as increased volatility."
"Define an """"Organisationwide Policy"""" and outline its key characteristics.","An """"Organisationwide Policy"""" is a ratified corporate plan of action that applies to all relevant staff. It serves as a legally binding document, providing a consistent framework for Trust action. These policies address Trustwide issues, are ratified by the Board or delegated Committee, require an Equality Impact Assessment, and are reviewed at least every three years."
Where can I find more information about my specific policy?,"For detailed information about a specific policy, refer to the policy document, visit the official LIC website, or contact LICs customer service. These sources provide comprehensive details about policy features, benefits, and other relevant information."
What role does market breadth play in quantitative momentum strategies?,"Market breadth refers to the number of securities participating in a market rally or decline. In quantitative momentum strategies, strong market breadth can indicate broadbased momentum across multiple securities, confirming the strength of the overall trend."
How do geopolitical events and global economic factors impact stock price prediction?,"Geopolitical events and global economic factors can impact stock price prediction by creating uncertainty, influencing investor sentiment, and triggering market volatility based on geopolitical risks or economic policies."
How do traders determine the optimal entry and exit points for pair trading?,"Traders often use statistical models, such as mean reversion strategies, to identify overvalued and undervalued assets within a pair and determine entry and exit points."
What is the significance of the lockin period in an insurance policy?,"The lockin period in an insurance policy is essential as it denotes a duration during which the policyholder cannot exit or withdraw funds. This ensures commitment to the longterm nature of the insurance contract, preventing premature exits and maintaining the policys stability."
How can sentiment analysis be integrated with technical analysis for stock trading?,Traders can combine sentiment analysis with technical indicators to validate trading signals and make more informed decisions based on both sentiment and price action.
What is a bearish divergence in trading and how can it be used as a signal?,"A bearish divergence occurs when the price makes a higher high while the indicator such as RSI or MACD makes a lower high, signaling a potential trend reversal and a sell signal for traders."
How do central bank policies influence trading models that integrate macroeconomic indicators?,"Central bank policies, such as interest rate changes and quantitative easing programs, can impact currency values and market liquidity, shaping trading strategies."
"Tax benefits of premiums and maturity payouts in investmentlinked plans, Updating beneficiaries, address changes, addingremoving riders, etc.,","For information on tax benefits in investmentlinked plans and details on updating beneficiaries, address changes, addingremoving riders, etc., refer to the relevant sections of the policy document. Following the specified procedures ensures accurate and timely updates."
What role does market efficiency play in pair trading strategies?,"Market efficiency influences pair trading strategies as traders aim to exploit inefficiencies or mispricings between correlated instruments, leveraging statistical models and analysis to identify profitable opportunities."
Does LIC offer online policy management tools that competitors lack?,"LICs online policy management tools can provide policyholders with convenient options for managing their policies. Comparing these tools with those offered by competitors involves evaluating features such as online premium payment, policy updates, and claim tracking. Policyholders can explore the respective online portals and apps of LIC and its competitors to assess the availability and functionality of online policy management tools."
How can traders differentiate between a pullback and a trend reversal when analyzing stock charts?,"Traders should look for key technical indicators, volume trends, and pattern formations to distinguish between a temporary pullback and a potential trend reversal before making trading decisions."
What if I lose my policy document?,"In case of a lost policy document, notify LIC immediately. The process to obtain a duplicate policy document involves submitting a written request, providing necessary details, and paying a nominal fee. Refer to the policy document or contact LIC for precise instructions."
What are life insurance riders?,"Life insurance riders are supplementary provisions that policyholders can add to their base life insurance policies to customize coverage. Riders offer additional benefits such as enhanced death benefits, coverage for critical illnesses, and waiver of premium."
What considerations are important when trading IPOs?,"Important considerations when trading IPOs include understanding the companys business model, growth potential, lockup periods, valuation, underwriters, and market sentiment."
What is a stock split?,A stock split is a corporate action in which a company divides its existing shares into multiple shares to increase liquidity and make the stock more affordable.
Summarize the key points to consider when receiving an insurance policy document.,"Personal Details Accuracy Ensure accurate personal information, promptly reporting any errors. Benefits Confirmation Review covered benefits for alignment with communicated details. Policy Schedule Check Verify sum assured, premium amount, and payment frequency for accuracy. LockIn Period Awareness Understand and note the lockin period, restrictions, and surrender terms. Exclusions and Riders Review Carefully read exclusions, assessing optional riders for added coverage. Regular Policy Review Periodically reassess the policy to align with evolving financial goals and personal circumstances. Regular reviews facilitate informed decisionmaking and keep policies aligned with changing needs. Instruction Highlight the features and flexibility of HDFC Lifes Click 2 Protect Life term plan. HDFC Lifes Click 2 Protect Life term plan stands out with Multiple Benefits Offers protection, longterm savings, and tax advantages. Benefit Illustrations Mandatory benefit illustrations provide transparency on return computations. Policy Schedule Details Clearly outlines sum assured, premium, and payment details. LockIn Period Information Informs about the lockin period and surrender terms. Exclusion and Riders Clarity Clearly communicates exclusions and offers optional riders for customization. The plan adapts to changing needs, allowing flexibility in coverage, premium terms, and additional features."
Is personalized agent support from LIC a significant advantage over onlinefocused competitors?,"Personalized agent support from LIC can be advantageous for those who prefer a guided approach to insurance. While onlinefocused competitors may offer selfservice options, the value of personalized guidance can be subjective and depends on individual preferences."
"Should I sell a stock if analysts downgrade it to a ""sell"" rating?","Consider the reasoning behind the downgrade, assess the companys fundamentals and future prospects, and make a decision based on your investment strategy."
What type of information is typically included in claims reports?,"Claims reports typically include details about the incident, claim number, date of loss, description of damages, adjusters notes, and the status of the claim."
"How do the tax benefits of LIC policies compare to competitors, both for premiums and payouts?","Tax benefits for LIC policies, including deductions on premiums under Section 80C and taxfree payouts under Section 1010D, are competitive. Comparing these benefits with those offered by competitors involves assessing the specific tax implications of each policy."
In what ways can machine learning and AI technologies enhance the effectiveness of quantitative momentum strategies?,"Machine learning and AI technologies can enhance the effectiveness of quantitative momentum strategies by analyzing large volumes of data, identifying complex patterns, and making faster and more accurate trading decisions."
What is a doji candlestick pattern and how is it interpreted as a trading signal?,"A doji candlestick pattern represents indecision in the market, with its opening and closing prices nearly identical, often signaling a potential reversal."
How does fundamental analysis help in predicting stock prices?,"Fundamental analysis helps in predicting stock prices by evaluating a companys financial health, management team, industry trends, and other factors that can impact its stock value."
What benefits are offered for EarlyStage Cancer?,"On the first diagnosis of specified EarlyStage Cancers, the plan provides a lump sum benefit of 25 of the Applicable Sum Insured and a Premium Waiver Benefit for the next three policy years."
What is Settlement Option?,"Settlement Option is a feature in life insurance policies where the policyholder, or the beneficiary in the case of the policyholders demise, can choose to receive the policy proceeds in installments instead of a lump sum. This option provides a steady stream of income over a specified period."
How can technical analysis help in predicting stock prices?,Technical analysis uses historical price and volume data to identify patterns and trends that can help predict future stock price movements.
What are some advantages of using statistical arbitrage strategies in stock trading?,"Some advantages of using statistical arbitrage include reduced reliance on market direction, potential for consistent profits from mispriced securities, and opportunities for diversification."
What are the common risks covered by general insurance policies?,"Motor Insurance Accidents Coverage for damages to the insured vehicle due to accidents. ThirdParty Liability Protection against legal liability for bodily injury or property damage to third parties. Health Insurance Hospitalization Reimbursement of medical expenses incurred during hospitalization. Critical Illness Coverage for specified critical illnesses and medical conditions. Outpatient Expenses Some policies cover outpatient medical expenses, including doctor visits and diagnostic tests. Home Insurance Property Damage Coverage for damages to the insured home or property caused by events like fire, natural disasters, or theft. Personal Belongings Protection for personal belongings within the insured property. Liability Coverage Protection against legal liability for injuries or damages to third parties on the insured property. Travel Insurance Trip Cancellation or Interruption Reimbursement for nonrefundable trip expenses due to unforeseen events. Emergency Medical Expenses Coverage for medical expenses incurred during travel. Lost Baggage Compensation for lost or delayed baggage. Personal Accident Insurance Accidental Death and Disability Lumpsum payment in case of accidental death or disability. Medical Expenses Reimbursement for medical expenses related to accidents. Commercial Insurance Property Insurance Protection for business property against damage or loss. Liability Insurance Coverage for legal liabilities arising from business operations. Business Interruption Compensation for financial losses due to interruptions in business operations. Cyber Insurance Data Breach Coverage for costs associated with a data breach, including notification, investigation, and credit monitoring. Cyber Extortion Protection against threats of cyber extortion and ransomware attacks. Liability Insurance Public Liability Coverage for legal liabilities arising from thirdparty injuries or property damage. Product Liability Protection against legal liabilities for injuries or damages caused by a faulty product. Marine Insurance Cargo Insurance Coverage for goods in transit, protecting against loss or damage during shipping. Event Insurance Event Cancellation Compensation for financial losses incurred due to the cancellation of planned events."
How can Monte Carlo simulation be used in predictive modeling for options trading?,"Monte Carlo simulation can be used in predictive modeling for options trading to generate multiple possible outcomes based on random sampling, helping traders assess the probabilities of different market scenarios."
What are the challenges of implementing adaptive trading algorithms?,"Challenges include data quality issues, overfitting, model complexity, hardware limitations, regulatory constraints, and the need for continuous monitoring and adjustment to ensure optimal performance."
How do traders identify pairs for statistical arbitrage strategies?,"Traders identify pairs for statistical arbitrage by analyzing historical price data, conducting correlation and cointegration tests, utilizing quantitative models, and monitoring sector relationships."
Can you explain the difference between life insurance and general insurance?,"Life Insurance Coverage Focus Life insurance provides coverage against the risk of death or, in some cases, survival for a specified period. The policy pays out a death benefit to the nominee or policyholders beneficiaries in case of the insured persons demise. Duration Life insurance policies can be either termbased, providing coverage for a specific term, or whole life policies that cover the insured person for their entire life. Benefit Payment The benefit is typically paid out in a lump sum or as periodic payments to the beneficiaries upon the death of the insured. Purpose The primary purpose of life insurance is to provide financial protection and support to the family or dependents of the insured in the event of the insureds death. Savings Component Some life insurance policies, such as whole life or endowment policies, may include a savings or investment component, allowing the policyholder to accumulate cash value over time. General Insurance Coverage Focus General insurance covers a broad spectrum of risks, excluding those related to life. It includes protection against various uncertainties, such as accidents, illnesses, property damage, liability, and other nonlife events. Duration General insurance policies are usually shortterm and provide coverage for a specified period. Benefit Payment The benefit payment in general insurance is made to compensate for financial losses suffered due to covered events. It may include repair or replacement of damaged property, reimbursement of medical expenses, or liability coverage. Purpose The purpose of general insurance is to mitigate financial losses and provide financial protection against unexpected events, excluding those related to life and death. Types of General Insurance General insurance includes various types such as health insurance, motor insurance, home insurance, travel insurance, liability insurance, and more."
Can quantitative momentum strategies be combined with other investment approaches?,"Yes, quantitative momentum strategies can be combined with other investment approaches such as value investing or fundamental analysis to create diversified portfolio strategies."
What is day trading?,Day trading involves buying and selling stocks within the same trading day with the goal of making quick profits.
How do market makers contribute to market liquidity?,"Market makers provide liquidity by continuously quoting bid and ask prices for securities, facilitating trading by ensuring there is always a counterparty willing to buy or sell."
How can seasonality in stock market data impact the accuracy of time series forecasts?,Seasonality in stock market data can introduce recurring patterns or fluctuations that may affect the accuracy of time series forecasts. Properly accounting for seasonality is important to make more precise predictions and avoid misleading results.
What if I lose my policy document?,"In case of a lost policy document, policyholders should immediately inform LIC and file a written request for a duplicate policy. The request should include details like the policy number, holders name, and a brief explanation of the loss. After verification, LIC will issue a duplicate policy document. Policyholders may need to pay a nominal fee for the duplicate copy. Contacting the nearest LIC branch or using online services can facilitate the process."
Explain the significance of the free look period in a life insurance policy.,"The free look period in a life insurance policy is significant as it allows policyholders to review the policy terms and features. During this period, if dissatisfied, the policy can be returned for a refund, promoting transparency and ensuring the policy aligns with the policyholders expectations."
Do any other companies offer attractive investment options within their plans?,"Several insurance companies, including LIC, offer investmentlinked plans providing opportunities for wealth creation. Comparing the investment options, returns, and associated risks with those of other companies helps determine the attractiveness of the offerings."
Why is selecting a nominee important when applying for life insurance?,"Selecting a nominee is crucial when applying for life insurance as it designates the person who will receive the sum assured after the policyholders death. While the spouse is often the default nominee, you can choose to add children or dependents, ensuring a clear and smooth claims settlement process."
Can machine learning algorithms be used to improve the accuracy of trading signals?,"Yes, machine learning algorithms can analyze vast amounts of data, identify patterns, and learn from historical trades to enhance the accuracy and predictive power of trading signals."
How can traders leverage data on consumer spending patterns to enhance their trading models?,"Consumer spending data offers insights into consumer behavior and overall economic activity. By analyzing spending patterns, traders can identify sectors poised for growth or decline and adjust their trading strategies accordingly."
What are some common challenges faced by investors when implementing quantitative momentum strategies?,"Challenges include data processing and interpretation, overfitting the model to past data, and the need for ongoing monitoring and adjustments to adapt to changing market conditions."
What are the key components of an insurance policy template?,"An insurance policy template consists of the following key components Declaration Agreements Definitions Exclusions Conditions These components outline details such as the insured individual or company, coverage limits, agreements, definitions of specific terms, exclusions, and the conditions under which the policy will be provided."
