question,answer
How can machine learning techniques enhance quantitative momentum strategies?,"Machine learning techniques can enhance quantitative momentum strategies by optimizing parameter selection, improving model accuracy, identifying nonlinear patterns in data, and adapting to dynamic market conditions."
What are some indicators that can be used in conjunction with time series analysis to forecast market trends?,"Indicators like Relative Strength Index RSI, Moving Average Convergence Divergence MACD, Stochastic Oscillator, and Bollinger Bands can complement time series analysis by providing additional signals for predicting stock market trends."
Highlight the key features and flexibility of HDFC Lifes Click 2 Protect Life term plan.,"HDFC Lifes Click 2 Protect Life term plan stands out with its features and flexibility, offering Comprehensive Benefits Provides protection, longterm savings, and tax benefits based on selected product features. Transparent Benefit Illustrations IRDAImandated benefit illustrations explain how policy returns are calculated for informed decisionmaking. Detailed Policy Schedule Clearly outlines sum assured, premium amount, and payment frequency for a comprehensive understanding. Informed LockIn Period Informs policyholders about the lockin period and surrender terms, ensuring clarity during critical situations. Clear Exclusions and Optional Riders Highlights exclusions and allows customization with optional riders like accidental death benefits. The plan is designed to adapt to changing needs, offering flexibility to adjust coverage and premium payment terms. HDFC Lifes Click 2 Protect Life ensures policyholders stay wellprotected through lifes evolving circumstances."
How does sentiment analysis help in risk management and decisionmaking for traders?,"By incorporating sentiment analysis into risk assessment models, traders can better manage emotional biases, assess market sentiment risks, and make datadriven decisions based on sentiment signals."
What are some popular quantitative momentum indicators used by institutional investors?,"Popular quantitative momentum indicators used by institutional investors include Moving Average Convergence Divergence MACD, Relative Strength Index RSI, and OnBalance Volume OBV."
What are the key differences between shortterm and longterm stock price momentum?,"Shortterm stock price momentum is focused on capturing quick price movements over days or weeks, while longterm stock price momentum is centered around identifying sustained trends over months or even years, catering to different trading styles and objectives."
How can policyholders submit a claim report for damages?,Policyholders can submit a claim report for damages by filling out a claims form provided by their insurer and submitting it along with supporting documentation such as photos and receipts.
Why do insurance companies use templates for communication letters?,"Insurance companies utilize templates for communication letters, especially notifications, to save time and ensure a standardized format. These letters commonly include sections like the address, particulars of the recipient, date, body containing important information, and signoff. Templates help maintain consistency and reduce the likelihood of errors in communication."
How can seasonal trends impact stock price prediction?,"Seasonal trends can impact stock price prediction by influencing consumer behavior, company performance, and market dynamics, requiring analysts to consider these patterns in their predictions."
How can one purchase LIC Bima Jyoti?,"LIC Bima Jyoti can be purchased both online and offline. For online purchase, visit the official LIC website, select the Buy Online option, choose LIC Bima Jyoti, and follow the steps for document submission and premium payment."
How does the concept of mean reversion apply to pair trading strategies?,"Mean reversion suggests that assets that have deviated from their historical relationship are likely to revert back to their average, providing opportunities for pair traders to profit from the convergence of prices."
What information can be found in insurance policy documents?,"Insurance policy documents contain details about coverage terms, exclusions, premiums, deductibles, policy limits, and contact information for the insurer."
How do regulatory bodies detect and address anomalies in stock prices?,"Regulatory bodies employ surveillance systems and sophisticated algorithms to monitor stock markets for unusual trading activities, investigate potential violations, and take regulatory actions as necessary."
What are the eligibility criteria for LIC Bima Jyoti?,"The eligibility criteria for LIC Bima Jyoti include a minimum sum assured of Rs.1 lakh with no maximum limit, entry age ranging from completion of 90 days to 60 years, maturity age from completion of 18 years to 75 years, policy term of 15 to 20 years, and premium paying term of policy term  5 years."
How can the Producer Price Index PPI be utilized in trading models integrating macroeconomic indicators?,"The PPI can be used in trading models to assess cost pressures on businesses, anticipate changes in consumer prices, and gauge inflation expectations."
How can seasonality and cyclicality be identified and accounted for in time series analysis for stock market forecasting?,"Seasonality and cyclicality can be detected using methods like seasonal decomposition, Fourier transforms, and autocorrelation analysis, and adjusted for in forecasting models."
What is the impact of inflation on stock trading models?,Inflation can impact stock trading models by influencing interest rates and investor behavior based on the anticipated purchasing power of future returns.
What is the difference between onbalance volume OBV and volumeweighted average price VWAP?,"Onbalance volume OBV is a cumulative indicator that combines volume and price movements, while volumeweighted average price VWAP calculates the average price a security has traded at throughout the day, weighted by volume."
What is an insurance claim and how does the process work?,"An insurance claim is a formal request made by the policyholder to the insurance company for coverage or compensation for a covered loss or event. The process involves reporting the claim, providing documentation, and working with the insurer to settle the claim."
How do traders use anomaly detection to detect market manipulation?,"Traders use anomaly detection to identify suspicious trading activities, such as coordinated price manipulation or insider trading, that could distort stock prices."
How can sentiment analysis be used in conjunction with technical analysis for trading decisions?,Sentiment analysis can complement technical analysis by providing additional insights into investor sentiment that can help traders make more informed decisions.
What role does investor psychology play in influencing stock price momentum?,"Investor psychology plays a significant role in influencing stock price momentum, as market sentiment, fear, and greed can drive momentum trends and impact trading behavior."
Summarize the key points and steps to understand a life insurance policy document fully.,"Understanding a life insurance policy document involves several crucial steps Benefits of a Life Insurance Policy a. Protection Full sum assured is available in the event of death, provided premiums are paid. b. Saving Can be used for future savings, such as for education or retirement. c. Discipline Encourages disciplined savings with periodic premium payments. Parties in a Life Insurance Policy a. Proposer Purchaser and premium payer, the policy owner with access to policy information. b. Insured Person on whose name the policy is purchased, and on whose death, the policy pays. c. Beneficiary Receives the death benefit upon the insureds demise. Benefits of a Policy Document a. Promise Represents the policyholders promise to achieve planned goals in a disciplined manner. b. Covers All Details Contains all policy benefits, terms, and conditions. Key Parts of a Policy Document a. Policy Schedule Includes sum assured, premium amount, and payment frequency. b. Benefit Illustration Shows returns at different rates and how the investible portion is computed. c. Death Benefit Describes the details and exclusions of the death benefit. d. Free Look Period Allows returning the policy within a specified period for a refund. e. Unit Linked Product Details the investment fund in unitlinked products. f. Legal Language Policies include a definitions section for clarity. Understanding the Legal Language a. Policies are written in legal language, and a definitions section clarifies terms used. Nomination a. The policyholder can nominate individuals to receive the policy benefit in case of death. Claims Section a. Provides instructions on how beneficiaries can make claims and options for receiving benefits. Claiming the Policy a. A lapsed policy can be reinstated through revival by paying due premiums and a penalty. LockIn Period a. A period during which the policyholder cannot exit or withdraw funds surrender may be an option. Tax Benefits a. Tax benefits on premium payment and maturity amount under the Income Tax Act, subject to prevailing laws. Bottom Line a. Financial goals change, necessitating a review of life insurance needs consider inflation when assessing goals. Its essential to read the policy document thoroughly, seek clarification on legal terms, and periodically review your coverage to align it with changing financial goals."
How can event studies help predict stock prices around corporate events?,"Event studies analyze how stock prices react to corporate events like earnings announcements, mergers, or product launches, providing insights into how these events may impact stock prices and aiding in prediction."
Can a product recall lead to a drop in a companys stock price?,"Yes, a product recall usually results in a decrease in a companys stock price due to potential damage to the brands reputation, financial losses from the recall process, and reduced consumer trust in the companys products."
What are the different sections of the document?,"Policy documents usually have sections covering policy details, terms and conditions, benefits, exclusions, premium payment information, and contact details. Each section serves a specific purpose and contributes to a comprehensive understanding of the policy."
How do I update my address or nominee details?,"To update address or nominee details, policyholders can fill out the required forms available on LICs official website or visit the nearest LIC branch. The forms typically include sections for updating personal information, and policyholders may need to provide supporting documents, such as proof of address or identity. After submitting the form and documents, the records will be updated accordingly."
How do I update my address or nominee details?,"To update address or nominee details, contact LIC through their customer service helpline or visit the nearest LIC branch. Follow the specified procedures and submit the required documents for a seamless update process."
How can historical data be used in predictive modeling for options trading?,"Historical data in options trading can be used in predictive modeling to identify patterns, trends, and correlations that can help predict future price movements of options and make better trading decisions."
"How do the tax benefits of LIC policies compare to competitors, both for premiums and payouts?","Tax benefits of LIC policies, including deductions on premiums and taxfree payouts, can vary based on the prevailing tax laws. Comparing these benefits with those offered by competitors involves reviewing the tax implications of their policies. Policyholders can refer to the respective policy documents, consult with tax professionals, or explore official tax authorities guidelines to understand the comparative tax benefits associated with LIC policies and those of competitors."
Can trading volume help predict potential breakouts or breakdowns in stock prices?,"Yes, trading volume can help predict potential breakouts or breakdowns in stock prices as significant changes in volume often precede major price movements, providing early signals for traders to anticipate market shifts."
"Where can I find specific information, like premium due dates or loan eligibility?","For specific details such as premium due dates or loan eligibility, refer to the respective sections in the policy document. Additionally, reaching out to LICs customer service or visiting the official website may provide the required information."
How do traders handle the challenge of overfitting in developing statistical arbitrage models?,"Traders combat overfitting by using outofsample testing, crossvalidation techniques, robust statistical methods, regularization techniques, and by focusing on fundamental economic relationships to develop more robust and reliable statistical arbitrage models."
How can one purchase LICs Cancer Cover Plan online?,"The plan can be purchased online by visiting the official LIC website, selecting the Buy Online option, choosing LICs Cancer Cover Plan, and following the steps for document submission and premium payment."
What types of insurance are typically included in a business owners policy BOP?,"A business owners policy typically includes property insurance, liability insurance, and business interruption insurance, providing comprehensive coverage for small businesses."
What is crosssectional momentum in quantitative momentum strategies?,"Crosssectional momentum refers to ranking securities based on their relative performance compared to other securities in the same universe, rather than focusing on absolute performance metrics."
How should I adjust my trading strategy in a lowvolume market environment?,"In a lowvolume market, consider reducing position sizes, increasing patience in waiting for confirmations, and being cautious with illiquid stocks to avoid unfavorable executions."
Why is the unemployment rate considered an important macroeconomic indicator in trading models?,The unemployment rate can influence stock prices as lower unemployment levels may indicate a strong economy with higher consumer spending and business growth potential.
What are the different sections of the document?,"The policy document typically consists of sections such as Policy Details, Terms and Conditions, Premium Payment Information, Benefits and Coverage, Exclusions, and Riders if any. Each section serves a specific purpose, and policyholders should carefully review all sections to grasp the full scope of their insurance coverage and obligations."
How does price momentum factor into quantitative momentum strategies?,Price momentum refers to the trend of a stocks price over a specific period and is a key factor in quantitative momentum strategies as it indicates whether a stock is gaining or losing momentum.
How long does it take to process a claim?,"Claim processing time varies based on the complexity of the case. LIC aims to settle claims promptly, and the duration can range from a few weeks to a couple of months. Regularly following up with LIC can help track the status of the claim."
How is insurance premium calculated?,"The calculation of an insurance premium involves several factors, making it somewhat complex but ultimately based on the insurers assessment of your risk as a policyholder. Heres a breakdown of the key elements 1. Base Rate This forms the foundation of your premium and is determined by the type of insurance youre seeking e.g., car, health, home. It reflects the inherent risk associated with that category, considering historical data and claim frequency. 2. Risk Factors These are personal characteristics or circumstances that influence your individual risk profile and can adjust your premium up or down from the base rate. Common examples include Age Younger drivers or individuals with certain health conditions might see higher premiums. Location Areas with higher crime rates or natural disaster risks might lead to increased premiums. Claims history A history of filing claims can indicate a higher risk and result in higher premiums. Driving record Traffic violations or accidents can increase car insurance premiums. Property features Newer homes with safety features might attract lower premiums compared to older ones. Coverage amount Choosing a higher sum insured for your belongings or property naturally increases the premium. 3. Additional Considerations Discounts Insurers might offer discounts for various factors like bundling multiple policies, opting for safety features, or maintaining a clean driving record. Company Expenses Operational costs, marketing, and agent commissions also factor into the final premium calculation. Putting it Together Imagine the base rate as a starting point. Each risk factor acts like a slider, moving the premium up or down based on your specific profile. Discounts can then bring the premium down further, while company expenses add to the final figure. Remember The exact calculation method varies between insurers, and their proprietary models might consider other factors. Its important to compare quotes from different insurers to find the best combination of coverage and price based on your individual risk profile. While a lower premium might be tempting, ensure the coverage adequately reflects your needs to avoid being underinsured in case of a claim."
How does term life insurance differ from whole life insurance?,"When it comes to life insurance, both term and whole life options provide financial protection for your loved ones upon your passing. However, their approaches and benefits differ significantly, so choosing the right plan depends on your specific needs and goals. Heres a breakdown of the key distinctions Term Life Insurance Think of it as a safety net Provides temporary coverage for a set period e.g., 10, 20, 30 years. Pure protection Pays a lump sum benefit to your beneficiaries if you pass away within the chosen term. Affordable premiums Lower cost due to the temporary nature of the coverage. No maturity benefit If you outlive the term, the policy expires with no payout. Ideal for Specific needs like covering a mortgage or supplementing child education expenses during your working years. Whole Life Insurance Combines protection and savings Offers lifelong coverage while building cash value over time. Dual benefits Pays a death benefit to your beneficiaries upon your passing, plus the accumulated cash value. Higher premiums Accounts for both insurance and investment components. Maturity benefit If you live past the policy term, you receive the cash value alongside any accumulated interest. Ideal for Lifelong protection and longterm wealth creation for retirement, inheritance, or other financial goals. Key Differences Focus Term prioritizes affordability and temporary protection, while whole life combines protection with longterm savings. Premiums Term has lower premiums, while whole life requires higher payments due to the cash value element. Coverage duration Term offers temporary coverage for a chosen period, while whole life covers you for as long as you live. Maturity benefit No payout with term if you outlive the term, while whole life gives you the accrued cash value. Choosing the Right Option Ultimately, the best choice depends on your individual circumstances. If you need affordable protection for a specific timeframe, term life is suitable. If you prioritize lifelong coverage and building wealth for the future, whole life might be a better fit. Consider your budget, desired coverage duration, and financial goals before making a decision. Consulting a financial advisor can help you assess your needs and recommend the most suitable life insurance plan for you."
How can traders distinguish between real liquidity and artificial liquidity in the market?,Traders can distinguish between real liquidity and artificial liquidity by examining the depth of the order book and monitoring trading volume to assess the true market supply and demand.
What role does volume play in stock price momentum analysis?,"Volume is crucial in stock price momentum analysis as it confirms the strength of the price movement  high trading volume validates the momentum, while low volume may signal a potential reversal."
Can news about a competitor impact a companys stock price?,"Yes, news about a competitor launching a new product or securing a large contract can potentially impact a companys stock price if investors believe it will affect their market share."
How does sector rotation play a role in quantitative momentum strategies?,"Sector rotation is a strategy that involves moving investments between different sectors of the economy based on their momentum and cyclical trends. In quantitative momentum strategies, sector rotation can be used to capitalize on trends within specific sectors that are exhibiting strong momentum."
What information is included in the policy document?,"Policy documents typically include details about the policyholder, coverage, premium payments, terms and conditions, exclusions, and other relevant information. It is essential to thoroughly read and understand the policy document to grasp all the aspects of the insurance coverage."
Exclusions for the Accidental Death Benefit Rider,"Exclusions for the Accidental Death Benefit Rider may include death resulting from preexisting conditions, selfinflicted injuries, or engaging in hazardous activities. Policyholders should carefully review the riders terms to understand the exclusions."
What role does machine learning play in adaptive trading algorithms?,Machine learning enables adaptive trading algorithms to learn from historical data and continuously optimize their strategies to adapt to market dynamics.
Free Look Period,"A free look period is a specified duration after purchasing an insurance policy during which the policyholder can review the terms and conditions. If dissatisfied, the policy can be canceled, and the premium is refunded, excluding some nominal expenses."
What is the purpose of an insurance claim?,An insurance claim is a formal request made by the policyholder to the insurance company for coverage or compensation for a covered loss or event. The purpose of an insurance claim is to receive financial assistance to recover from the loss or damage covered by the insurance policy.
How can traders use volume analysis in conjunction with other technical indicators for more accurate trading signals?,"Traders can combine volume analysis with indicators such as moving averages, relative strength index RSI, and Fibonacci retracement levels to confirm signals, identify divergences, and enhance the overall accuracy of trading decisions."
Is the policy term length flexible and aligned with my financial planning horizon?,"LIC policies often offer flexibility in choosing policy terms. To align with your financial planning horizon, explore policy options that provide the desired term flexibility. Carefully review the policy details to understand the available term options and choose accordingly."
When should you consider selling a stock?,"You should consider selling a stock when it reaches your target price, the fundamentals of the company change negatively, or if you need to rebalance your portfolio."
How does moving averages help in forecasting stock market trends using time series analysis?,"Moving averages smooth out price fluctuations, making it easier to identify trends and potential reversals in the market."
What are some common pitfalls to avoid when responding to stock price momentum?,"Overtrading, ignoring risk management principles, and failing to adapt to changing market conditions are common pitfalls to avoid when responding to momentum."
Does LIC offer online policy management tools that competitors lack?,"LIC provides online policy management tools, allowing policyholders to access information, pay premiums, and perform other transactions online. While competitors may offer similar features, evaluating the userfriendliness and functionalities can help determine the effectiveness of LICs online tools."
"Where can I find specific information, like premium due dates or loan eligibility?","Specific information, such as premium due dates or loan eligibility, can be found in the respective sections of the policy document. Policyholders are encouraged to refer to the Premium Payment Information section for details on due dates and the Loan Eligibility section for information related to policy loans. In case of any uncertainty, contacting LICs customer service or visiting the official website can provide additional assistance."
How does pair trading differ from traditional stock trading strategies?,"Pair trading involves simultaneously buying and selling two correlated securities, while traditional stock trading involves buying or selling individual securities."
What role do candlestick patterns play in generating trading signals?,"Candlestick patterns represent price action and can signal potential trend reversals or continuations. Traders look for specific patterns, such as doji, hammer, or engulfing patterns, to make informed trading decisions."
How does stock trading differ in a bull market versus a bear market?,"In a bull market, stock prices rise, creating an optimistic investing environment, while in a bear market, prices decline, leading to pessimism and a focus on preserving capital rather than aggressive trading."
